format,name,description,minting_tool,sensitive_content,series_number,series_total,gender,Attributes,UUID,Hash
CHIP-0007,saro-the-clothemaker,The yoruba man that stole the king's wife.,,False,298,420,Male,hair: covered eyes: grey teeth: white clothing: red and yellow agbada accessories: cap expression: straight face strength: good-looking weakness: womanizer,7e10af4e-1252-4f96-83a8-78411e152bae,d994db6aa65d8759e87d4cc9c35d5a0a61aa3e76f6f6eb034ebd10f68e5180e9
CHIP-0007,kalu-the-ichie,A man of wealth with afluence spreading all over the east,,False,299,420,Male,hair: covered eyes: sky-blue teeth: white clothing: orange plain and pattern shirt accessories: cap expression: happy strength: wealth weakness: pride,482ab247-73a4-4ff8-9172-732f3d0729b8,5321f9f66005ebc35bc5a2729716743e7f511756d871084e41143cf0ae6f6209
CHIP-0007,tamuno-the-prince,An Ijaw prince who is also the heir to the throne,,False,300,420,Male,hair: covered eyes: sky-blue teeth: closed clothing: akan  accessories: cap expression: straight-face strength: caring weakness: easily deceived,108447d1-f2d5-4816-8ebb-599286c3fabf,e8c0a09663d2dbaa4b870df5df7f1507abcb5af20153d6eebfe9dc38519215ff
CHIP-0007,wendy-the -banker,"Wendy loves working in the bank, as she gets to meet different people.",TEAM SCALE,False,301,420,Female,hair: dark red   eyes: blue  teeth:none  clothing: blue and yellow ankara   accessories: none  expression: shocked  strength: none   weakness: none ,587645e2-5ace-11ed-9b6a-0242ac120002,94778ea82783f52e8a314742d7945fde7fc82b9f3a7ba4317297b1abae1879af
CHIP-0007,uduak-the -dark horse,Uduak looks innocent and has the whole apartment bugged,,False,302,420,Female,hair: brown   eyes: blue   teeth:none   clothing: multi-colored ankara  accessories: none  expression: witty  strength: none   weakness: none ,58764862-5ace-11ed-9b6a-0242ac120002,60ae9184dafe7fce02e53a675dc1740a2c9a19b464b62108dbf850d059232400
CHIP-0007,timeyin-the -eccentic,Timeyin is as eccentric as they come with no care for others opinions,,False,303,420,Female,hair: brown   eyes: blue   teeth:none   clothing: multi-colored ankara  accessories: smoking pipe  expression: high  strength: none   weakness: none ,58764a2e-5ace-11ed-9b6a-0242ac120002,588ad1ee4ae790bb2aeb98a0fff3ac28645d79093707a27f411512fd46da8230
CHIP-0007,omawunmi-the -businesswoman,Omawunmi is a no-nonsense woman with a shop in idumota,,False,304,420,Female,hair: pink   eyes: blue   teeth: white teeth   clothing: yellow ankara  accessories: none  expression: angry  strength: none   weakness: none ,58764b78-5ace-11ed-9b6a-0242ac120002,b9c820f597bf777a1f3cdfa61aae53a5d453b7949192b5ab440a64c468c05ee0
CHIP-0007,halima-the-housewife,Halima loves to bake and cook for her children,,False,305,420,Female,hair: brown  eyes: blue   teeth: none   clothing: ankara designed with yellow; red and green  accessories: none  expression: tired   strength: none   weakness: none ,58764d8a-5ace-11ed-9b6a-0242ac120002,85995070ec57d3ba912cf859d4f274837a560c65323f3cb267ac08335730f3cd
CHIP-0007,muna-the -block sister,Muna loves to tell everyone in the block about her younger escapades,,False,306,420,Female,hair: black  eyes: blue   teeth: none  clothing: wolf-skin ankara  accessories: headgear  expression: shocked  strength: none   weakness: none ,58764ea2-5ace-11ed-9b6a-0242ac120002,e344137361b2d77964bbe965b0b6a34a38fba3709d48fd5cc02bd3d77a6bcdda
CHIP-0007,stella-the -gossip,Nobody gossips on the block like stella when smoking.,,False,307,420,Female,hair: red  eyes: covered eyes  teeth: none  clothing: black ankara with bright design   accessories: none  expression: calm  strength: none   weakness: none ,58764fd8-5ace-11ed-9b6a-0242ac120002,ec204ee2aae4cbb5fa7a2bfadb8f79ab5f0da843c2d2a4c7389ec7c2d0f597f4
CHIP-0007,agbani-the-wannabe,Agbani loves to shop antique decorations for her mansion in idi-iroko,,False,308,420,Female,hair: purple hair  eyes: covered eyes   teeth: none   clothing: blue one-armed dress   accessories: none  expression: happy  strength: none   weakness: none ,5876542e-5ace-11ed-9b6a-0242ac120002,1f21c5f5f7169bb9e94f373678e6068e1f1804b8ae106aeb61df52b3089cfe91
CHIP-0007,asante-the -warrior,Asante came from a long line of warriors in Ghana,,False,309,420,Female,hair: pink braids  eyes: covered eyes   teeth: none  clothing: one-armed brightly colored dress  accessories: none  expression: calm   strength: none   weakness: none ,58765578-5ace-11ed-9b6a-0242ac120002,37f706cfa7d3819294fc246e6fe774e1946a9a138887529b66fcf4a54399fa64
CHIP-0007,hilda-the -insomaniac,Hilda prefers to sleep during the day.,,False,310,420,Female,hair: pink   eyes: covered eyes   teeth: none   clothing: multi colored ankara   accessories: none  expression:calm   strength: none   weakness: none ,5876569a-5ace-11ed-9b6a-0242ac120002,8e1992d78b94eb54ca81d218cc41978150c91508cbc2bad3846f992a45c8aca0
CHIP-0007,sisi yemi-the -street aunty,Sisi Yemi is everyone's favourite street aunty.,,False,311,420,Female,hair: dark brown   eyes: brown eyes  teeth: none   clothing: blue and yellow ankara  accessories: none  expression: shocked   strength: none   weakness: none ,587657a8-5ace-11ed-9b6a-0242ac120002,928c08be36c30a9bf255a98098138ed42ea602fffb12e9738e12156b0bb6c7eb
CHIP-0007,chiamaka-the -bully,Chiamaka hates people in her business and likes to scare the kids on the block,,False,312,420,Female,hair: pink  eyes: brown  teeth: none  clothing: multi-colored ankara  accessories: smoking pipe  expression: strong  strength: none   weakness: none ,587658ca-5ace-11ed-9b6a-0242ac120002,f1a1424008c4123e8eb4dec09ba8e78e877f1159685ebe6c5b8bfc8e258725a6
CHIP-0007,gift-the-fashionista,Gift has always been bold and that spreads to her fashion sense too.,,False,313,420,Female,hair: brown   eyes: brown   teeth :none   clothing: multi-colored ankara  accessories: none  expression: witty  strength: none   weakness: none ,58765adc-5ace-11ed-9b6a-0242ac120002,f2f9b3c940d6c39447a60be68b3cf7400794b1ddcccbc6b8b23eb470ce6fd358
CHIP-0007,omoyene-the-weirdo,Omoyene likes to murmur to herself and talks about seeing ghosts,,False,314,420,Female,hair: brown  eyes: brown  teeth: none  clothing: yellow ankara  accessories: none  expression: calm  strength: none  weakness: none ,58765bea-5ace-11ed-9b6a-0242ac120002,571f05ab09181f29a2f8ff6353978cd99e7010706ecf563a18242c11353f55dc
CHIP-0007,maria-the -freshface,Maria likes to believe the world is sunshine and rainbows while blowing gum,,False,315,420,Female,hair: pink  eyes: brown eyes  teeth: white teeth  clothing:yellow; greem and red ankara   accessories: none  expression: furious   strength: none   weakness: none ,58765d02-5ace-11ed-9b6a-0242ac120002,4b941098cd2b5ae57b2fbff245e4b9a893dffecded448e1fefb59e1de67322e2
CHIP-0007,monica-the -smoker,Monica is never found without a pipe and loves to interject in every conversation.,,False,316,420,Female,hair: grey   eyes: covered eyes  teeth: none  clothing: black ankara with bright designs  accessories: yellow glasses  expression: hip   strength: none   weakness: none ,58765e24-5ace-11ed-9b6a-0242ac120002,e2d9e98d47682e79a881158dd5615769714fb8a090f21185a15c0500aceea9aa
CHIP-0007,janet -is always -found singing ,Janet is always found singing in whatever activity shes doing,,False,317,420,Female,hair: purple   eyes: covered eyes  teeth: none  clothing: yellow and blue ankara  accessories: yellow glasses  expression: cool  strength: none   weakness: none ,cef902bc-5afc-11ed-9b6a-0242ac120002,43df10a4dc6ecedaae21e2bd33cca21fddd924592b4eef33948ee6604e04eaf9
CHIP-0007,emi-the-reggae-girl,EMi is a beautiful dancer; she rules the reggae world.,,False,318,420,Female,hair:pink braids   eyes: covered eyes   teeth: none  clothing: multicolored ankara  accessories: yellow glasses  expression: happy  strength: none   weakness: none ,cef9060e-5afc-11ed-9b6a-0242ac120002,75e9d58013e0cfc9b4313be0569e821f79ce1518adbd325a363eed9ea4527143
CHIP-0007,aisha-love-the-life-of-the-party,Aisha always party during the weekend,,False,319,420,Female,hair: red   eyes: covered eyes  teeth: none  clothing: wolf-skin ankara  accessories: yellow glasses  expression: hip  strength: none   weakness: none ,cef907a8-5afc-11ed-9b6a-0242ac120002,1100047aec48d87c7ef134291f97837297bf7eb0885ec45efa32221b23977434
CHIP-0007,amaka-the-tailor,She sews the most beautiful dress in the hood,,False,320,420,Female,hair:grey  eyes: covered eyes   teeth: none  clothing: black dress  accessories: yellow glasses  expression: happy  strength: none   weakness: none ,cef9091a-5afc-11ed-9b6a-0242ac120002,95be5ba537f02db213edf1c53719c07cd04f029b7fca284ff5229d5d4a68b6d8
CHIP-0007,omunyinyi-the-stoic,omunyinyi wears a Kitenge coat,TEAM SANDPAPER,False,321,420,Male,hair: bald eyes: tearyteeth: noneskin: brownskinclothing: checked ankara accessories: none expression: teary strength: powerful weakness: self-loathing,c2d6a3ac-1d4d-4268-ba7f-4f0f8f50c1ab,8b08c2f610f1609659dc1c455d900f6c112147b73b49fc4567c5aef5210b3200
CHIP-0007,kamau-the-sleeper,closed eyes meditating,,False,322,420,Male,hair: blad eyes: closed teeth:  noneskin: brownskin clothing: black ankara accessories: none expression: flat strength: open to suggestion weakness: always sleepy,20330f5c-40c2-4f6a-b9d8-d1d04fb97daf,b7ca34588470e22b2d49dff98b102a183858cb04ff2e1aef68517a48f9aa363a
CHIP-0007,mutiso-the-lastborn,masked up mutiso dozing off,,False,323,420,Male,hair:bald;; eyes: closed teeth: none skin: brownskin clothing: yellow ankara accessories: none  expression: tired strength: consistency weakness: pessismist,0706c338-42eb-4d26-84ea-c24b39628200,1ef300cc932e4e41fedc9dd34986e3b2f91a579c0f91d616fd90a5c395916b08
CHIP-0007,omondi-the-vegeterian,omondi wears a green coat,,False,324,420,Male,hair:bald; eyes: sharp eyed teeth: none skin: brownskin clothing: green ankara accessories: none expression: alert strength: leader weakness: anxious,bfb5e8d5-d7a7-4aa8-85e8-d7d9afd4adb3,3a723a52eb56b633259e5328eb3a0fbdf4b2d1ecbb2e213543bbd8fce606810d
CHIP-0007,barasa-the-optimist,looks up to the sky and makes a wish,,False,325,420,Male,hair: bald; eyes: blue teeth: none skin: dark skin clothing: brown ankara accessories:none expression: awake strength: strong willed weakness: immoral,2da4bef4-38cc-4414-99ad-7361fac04b2b,a6eabe8fdd0dc1f0af536468866c86dc6a46b7d75732573ad8fd5429e93f6fdd
CHIP-0007,mwembu-the-elder,"old but not so old, with yellow his favorite color",,False,326,420,Male,hair: bald; eyes: black teeth: none skin: dark skin clothing: dark ankara accessories: none  expression: plain strength: fulfilled weakness: angry,36181230-6ac9-417f-af5c-23bdd2c25ecb,8ef2606c6bee0424a7c33d9ab89675f0d79c22ec3cd0a2835439be4b217cd0e1
CHIP-0007,mbogi-the-fighter,masked up mbogi after capture,,False,327,420,Male,hair: bald;eyes:  blackteeth: noneskin: darkskin clothing: onesideankara accessories: noneexpression: willfull strength: fighter  weakness: rebellious,3a7bc3c4-1463-42ce-84c9-07337da64435,ac46035d083321f9b3d973b97813d9ea95b24d6fc6a4992c1e4426a056d29618
CHIP-0007,mrosho-the-runner,masked up mrosho,,False,328,420,Male,hair: bald; eyes: sea blue teeth: none skin: darkskin clothing: purple ankara accessories: none expression: alert  strength: visionary  weakness: destructive,b2ca2c76-3b6d-43f1-8cc9-089b6ab83876,f44ec5f236be853cb00e3467b97c2179da0781ae9a17850db226e47cbc99f6a2
CHIP-0007,milele-the-african,milele with a nice african print in orange,,False,329,420,Male,hair: bald; eyes: blue teeth: none skin: dark skin clothing: orange ankara accessories: none expression: timid strength: leader weakness: failure,644b0259-d75c-456d-934c-ce7c052bad3a,92a5fc255b9920562e972503696156747f96c4d13134bf866e595dbd314321b7
CHIP-0007,olebon-the-oloibon,olebon in customized buba sokoto,,False,330,420,Male,hair: bald; eyes: closed teeth: none skin: darkskin clothing: animal print accessories: none expression: surprised strength: empathy   weakness: easily bored,de261efe-731d-461e-b2e4-42edd2f48f72,1c4cd0053e7376c211b2621080e5a36ebfcefca8c570c385f09d8a7feb2248f0
CHIP-0007,chifu-the-maasai,clothing inspired by maasai shuka,,False,331,420,Male,hair: bald; eyes: closed teeth: none skin: none clothing: ankara shirt accessories: none expression: visionary strength:  authentic weakness: selfish,239933c4-7177-4b5b-86e8-e6f952301344,4b77d97f148dda4e31c5803c7369024a5d5e46bcb64a85851f71004877f98337
CHIP-0007,mwangaa-the-voice,mwangaa the chief,,False,332,420,Male,hair:  bald; eyes: blue teeth: none skin: darkskin clothing: white lined ankara accessories: none expression: kindness strength:  brave weakness: impatient,49179b62-812d-4d0f-b518-4af7fa79f8bc,b6cb9ba81e1662cc8fb31bd86dab6cf2145b7265109cf07a146d255354be9370
CHIP-0007,waforte-the-first,masked up man who does sleep a lot,,False,333,420,Male,hair: bald; eyes: closedteeth:none skin: darkskin clothing: jean ankara accessories: none expression: shy strength:  weakness: selfish,871912a8-d96e-4594-b7b3-450d94ee6924,9f29b1a31bac4c472b582249fc7d078bb7b8d5084ff52d3a8a8e64866a9200e5
CHIP-0007,kariuki-the-prayerful-one,kariuki closes his eyes,,False,334,420,Male,hair: bald; eyes: closed eyes teeth: skin: clothing: accessories: expression: bored strength: intelligent  weakness: passive,6a5b6fa6-0f91-4b01-957f-c766945eb704,ee2f3dd854e8e700e777bb72743b14aaeebd38ecb93389f0b484f0ea336cdc66
CHIP-0007,kenyanese-the-priest,masked up man with with white cloth,,False,335,420,Male,hair: bald; eyes: white teeth: none skin: darkskin clothing: white jean shirt accessories: none expression: calculative strength: kind weakness: takes things personally,0706c338-42eb-4d26-84ea-c24b39628200,473e14c021d051d3abe2483785982c15ba41d3c90bbe51ccefb73fdb72bd4342
CHIP-0007,nyimbo-the-singer,glasses and a pot for the night,,False,336,420,Female,hair:dreadlocks; eyes: glassed up teeth:none skin: brownskin clothing: off shoulder ankara accessories: a pot expression: free spirited strength: fair weakness: impatient,d05af807-b3e9-4ad3-8df1-b7864d2daa33,b35e9981dc19b39aaedc8f7df83f339cf8c6bb7eefbbca65998dcabdca0755b0
CHIP-0007,maathai-the-nobel-winner,mathaai the warrior,,False,337,420,Female,hair: pink afro; eyes: glassed up teeth: none skin: brownskin clothing: colored ankara accessories: noneexpression: strict strength: leadership  weakness:short sighted,0871cb8c-8d56-445d-92c7-01793f327707,5796c92a4a8905708752e1d85b38a2f43e3056bb6a533b2f55849c438d0e70f7
CHIP-0007,tish-the-angry-one,angry tish with specs on,,False,338,420,Female,hair: black huge afro; eyes:  none teeth: broken teeth skin: brownskin clothing: offshoulder ankara accessories: none expression: disgusted strength: blunt weakness:greedy,750a89dc-44ff-43bf-8211-b7776f1b5e52,0a25bc4e66630fa3a3f5bb4ca09e87dea74161c379f24079ec9cee6ae079a9ce
CHIP-0007,wamenza-the-winner,wamenza the leader,,False,339,420,Female,hair: laid back; eyes: none teeth: none skin: brownskin clothing: offshoulder ankara accessories: noneexpression: meditative strength: strict weakness: impulsive,7348c9ed-4ac9-4785-9434-0a1f0dcaf8d8,e7fe6e0c8b53538e625c95d5a8972580e74f8dd5e506fba571b14617f6410e6f
CHIP-0007,isaya-the-track-king,isaya the traveller,,False,340,420,Male,hair: none eyes: glassed up teeth: none skin: brown skin clothing: bright ankara accessories: none expression: taken aback strength: straight forward weakness: selfish,41781a16-d2b8-4fc6-a1f4-b9fffc5c95ba,7a8b201232dd08285faee4cb6adfc208a6a051a692ecfe953bf4f4e544c843e8
CHIP-0007,mansur-the-partyrider,Mansur is the life of a party and never caught dulling.,TEAM RULER,False,341,420,Male,hair: none; eyes: ash grey; teeth: none;  clothing: agbda; accessories: studs; expression:happy; strength: intelligent; weakness: red whine,78db0f29-3936-4d9c-bb90-3dbf20dba2dd,a37237fc145904d453d2c261b48aaa723bfabba3dec4b844a1752bc3b60c8deb
CHIP-0007,tola-the-businessman,Tola loves business and owns several shops in Idumota.,,False,342,420,Female,hair: none; eyes: midnightblack; teeth: none;  clothing: purple blowse; accessories: mask; expression:furious; strength: powerful; weakness: love,1c5d5a6b-cf04-4bf9-978e-22a7e9bc5819,80911c71cbe134cdb248bf63c7395bfaa483490e869684e173a63c069d69acf3
CHIP-0007,abdullahi-the-honorable,"Popularly called ""buje budanu"" a godfather who lavishes money on young gees.",,False,343,420,Male,hair: none; eyes: blue-blackish; teeth: none;  clothing: yoruba attire; accessories: none; expression:anxious; strength: foreseer; weakness:indecision,dd708276-445f-4483-8357-fc08e999328f,1e191c9d938344bdc120b87da34e7f7a29a675138c9b9292c30152346b29ba0e
CHIP-0007,ojukwu-the-badguy,Ojukwu is a business minded guy but fun to be with.,,False,344,420,Male,hair: bald; eyes: eagle eyeball; teeth: none;  clothing: yellow lining blowse; accessories: none; expression: none; strength: good eyes for fashion; weakness: lack will power,76c1eabf-15ea-446a-8426-472982c4d800,90b2824555d05a7467b61432322c48f844c01f4bab492a17ff5608e80c782a37
CHIP-0007,odunsi-the-egbonadugbo,Odunsi loves to advise and people in the community rely on him.,,False,345,420,Male,hair: none; eyes: dark brown; teeth: none; clothing: one shoulder gown; accessories: none; expression: none; strength: elegant; weakness: easily depressed,2912ab8b-5875-4277-a5c2-a0209aee90ae,680b8afc85e39378cb08bb45b9a8ea9a3ac6947fa98b4e9c74c46523841ea39e
CHIP-0007,ogogo-the-sugardaddy,A rich oil magnate who loves to solve young women's problems with his millions.,,False,346,420,Male,hair: none; eyes: cat eyes; teeth: none; clothing: purple danshiki; accessories:nose mask; expression: straight face; strength: brave ; weakness: too selfless,aa575f30-04ad-45f9-a798-199465117793,683918c1cdc5a15fd9dade06b502acae5494c77d8eba8a1e026668300f385c6c
CHIP-0007,suli-the-amalaseller,Suli sells amala with respect and people say that's the secret to her sweet food.,,False,347,420,Female,hair: low punk; eyes: cat eyes; teeth: none; clothing:brown babarigai; accessories:none; expression: furious; strength: wealthy; weakness: too emotional,46fd4821-04dd-4f65-9290-c130a00c4c93,5edcdf7406ad44362454aa68f9d72a7d2ee8f0238d7ef0f26609cf0873be51fc
CHIP-0007,dolapo-the-afrocentric,Dolapo loves African prints and loves to showcase culture.,,False,348,420,Female,hair:bald; eyes: brown; teeth: none; clothing: one sided blowse; accessories: nose mask; expression: none; strength: beautiful; weakness: forgetful,cbab232b-5c62-4df8-867b-018a2e496cd4,cbf75e6d288dc831c5b7d4b7d89e787eb3d7f12a89929244e14d7b142ed7247b
CHIP-0007,danjuma-the-saddist,Danjuma is a grumpy man no one likes to associate with him.,,False,349,420,Male,hair: none; eyes: sky blue; teeth: none; clothing:purple agbada; accessories: neck beads; expression: excited; strength: outspoken; weakness: boring,5a42af57-186e-425b-b6b1-f72bda4911ef,9a187760b269b23c4d09f0291e59b241e14b3927832382dedbab69fb4e83ed94
CHIP-0007,chinedu-the-farmer,A hardworking farmer who has 6 boys who help out on the farm.,,False,350,420,Male,hair: none; eyes: black; teeth: brown; clothing: one sided gown; accessories: none; expression: blushy; strength: easily loved; weakness: get angry easily,9e8a55d7-0d8d-465d-a628-08ddd387a2c6,30e984f9324ab754c70c4eabf33cfb63346154528d5239ae02c9ebc8d2289bb3
CHIP-0007,kola-the-baldguy,Kola is every girls dream man because of his hair style.,,False,351,420,Male,hair: low cut; eyes: mouse eyes; teeth: none; clothing: gbariye style; accessories: nose mask; expression: unhappy; strength: good eyes for details; weakness: sluggish,c32f1757-da9c-49e8-bd79-510a42b6971a,f8e86ee10393e19712a548c1c8d99d38f2df371e99324dd269d581623fd9c6e4
CHIP-0007,bola-the-bosslady,A lady who supports the boy child by providing scholarship to young talented males.,,False,352,420,Female,hair: low cut; eyes: brown; teeth: none; clothing: short orange gown; accessories: nose mask; expression: none; strength: industrious; weaknes:spend lavishly,09ff910d-a2be-49d5-8b27-b9378458701c,ef0ae453cc806b1ae48a711c1ae74fc16531e3ce5f08fedb226d4664fe18eb71
CHIP-0007,kunle-the-alienguy,Kunle is special and easily get noticed even in the midst of crowd.,,False,353,420,Male,hair: green punk; eyes: green; teeth: none; clothing: purple agbada; accessories: purple beads; expression: unbothered; strength: very energetic; weaknes:eaaily give in,dea2f5d8-e3ba-4d3f-9a17-0a7edfd0c100,ce7105789b46d6f1140cf68b9116f2e1b23de6953d7e9e665f4097c4b69fe5b2
CHIP-0007,segun-the-sharp,Segun drives with caution and people love him for that.,,False,354,420,Male,hair: green punk; eyes: black ; teeth: none; clothing: orange buba; accessories: nose mask; expression: bitchy; strength: team player; weaknes: none,f9159a9c-f48d-4aee-bcc1-63c86209f806,7bbb50d73286288161454aa78f517a63e7076c386f5b23fadef2171ccbc3b303
CHIP-0007,ola-the-hardguy,Ola may be feared but he is such a coolheaded champ.,,False,355,420,Male,hair: none; eyes: closed eyes; teeth: none; clothing: purple buba; accessories: none; expression: sick; strength: quick recovery power; weaknes: get ill frequently,a814fc77-bdfa-4e50-8ba8-3e4e4bcfb3c0,d1f355e82900b0ce586a9bac140af723431f248d022ceb34d7e8209e4751c432
CHIP-0007,emeka-the-chief,Crowd are always at Emeka's house because of his selflessness.,,False,356,420,Male,hair: none; eyes: closed eyes; teeth: none; clothing: pakaja attire; accessories: none; expression: bossing; strength: easily comman respect; weaknes: not a ladies man,195e89c8-0b6f-43ad-9a2c-d20f03439e96,7b978edef4e3130095bce65df7ce8a6c885965ee55eb112ea67e9c167c8819d6
CHIP-0007,ugochukwu-the-celeb,Ugochukwu is an online celebrity with many followers on social media.,,False,357,420,Male,hair: white blode; eyes: closed eyes; teeth: closed teeth; clothing: black gown; accessories: gold shades; expression: bitchy; strength: enterprising; weaknes: too emotional,74775cda-cff4-4d21-8819-693127598eca,8e7448f2fe0ce7147299039070372740318c8fd33704511e40858a6a31854565
CHIP-0007,adekunle-the-yorubademon,He might be every woman's man but faithful and loyal to one.,,False,358,420,Male,hair: gobi cap; eyes: closed eyes; teeth: closed teeth; clothing: ghana dansiki; accessories: gold shades; expression: owanbe mood; strength: from a walthy home; weaknes: disrespectful,5c98c2d8-3144-4e08-8a0f-9b8d7e4f5aa7,954362742a07000d261cc32197c8f24e8c814b5815dd4b219e7fe505b3143690
CHIP-0007,favour-the-fashionista,Combining dresses is not a problem for Favour.,,False,359,420,Female,hair: black ghana weaving; eyes: cat eyes; teeth: none; clothing: senegalese blowse; accessories: gold shades; expression: party rider; strength: smart; weaknes: lazy,19fc15c3-80fe-4d45-a2fe-be8f087d57c4,2b3b47aaf106eb3c3210e0db03a8e0e13e7e461d5bc47906d7ac055137e25262
CHIP-0007,jane-the-slayqueen,Jane is always found in the midst of men and loves partying.,,False,360,420,Female,hair: long grey braids; eyes: closed; teeth: black lips; clothing: black short gown; accessories: gold shades; expression: happy; strength:very intelligent; weaknes: have mood swings easily,74775cda-cff4-4d21-8819-693127598eca,71aa5a9fdbfee96e9785a201207bb6b1968666be5fb09ab5d0e27c6d121f6455
CHIP-0007,osas-the-ceo,Meet Osas; a Gen-Z CEO with the British accent.,TEAM VBELT,False,361,420,Female,hair: purple dreadlocks;  eyes: none; teeth: none; clothing: danshiki;  accessories: gold glasses; expression: none; strength: none; weakness: none,b10f7e42-4778-49db-820b-dabbad75504a,b6f40d34b7e194caf93c0ca58f407d6b6628fb8d2620782e5d97a8c7527301d8
CHIP-0007,nneka-the-rainbow babe,Nneka; the happy rainbow babe with the vibes.,,False,362,420,Female,hair: pink;  eyes: none; teeth: none; clothing: blue and black bichrome; accessories: gold glasses; expression: none; strength: none; weakness: none,e7e20ab8-03e0-4e0a-80aa-6e193f84426e,b89068dc494ca55a4f1fbf7a2b4e7e744aaf628e6b5bd08c6f560aafa6d8eb66
CHIP-0007,temitope-the-spoilt girl,Temitope; our favourite daddy's girl.,,False,363,420,Female,hair: none; eyes: none; teeth: vampire teeth; clothing: right one-shoulder wax print; accessories: gold glasses; expression: none; strength: none; weakness: none,10cbcbcb-754e-4175-b85d-d0c7eafa16a2,bbc51e40a1736eda390d305202b943e127ed8f3ec989ed4c7d1935dc539571ec
CHIP-0007,bekeh-the-party animal,Baby Bekeh is life of the party that goes home with your charger.,,False,364,420,Female,hair: dark brown;  eyes: none; teeth: none; clothing: left one-shoulder wax print; accessories: gold glasses; expression: none; strength: none; weakness: none,f0558235-3043-46e5-b26c-5bde83cc67fb,3d7d6fbec7b3f1416f9b07c62c68a7a15e114dc19ff85762931b12ec3dc40b94
CHIP-0007,nana-the-tech lady,Nana; the tech madam that doubles as Kumasi Adele in her bathroom every morning.,,False,365,420,Female,hair: black; eyes: none; teeth: none; clothing: print kente;  accessories: gold glasses; expression: none; strength: none; weakness: none,e0858913-7050-4c4a-a2a0-442a88463334,8c1856a9a50f56d8db66192aac8c76a9ff5b7fa500bfc0f52abbdd4f1c2eb04d
CHIP-0007,rofiat-the-marketer,Rofiat; the distressed marketing intern.,,False,366,420,Female,hair: purple dreadlocks; eyes: brown; teeth: none; clothing: danshiki; accessories: none; expression: none; strength: none; weakness: none,1e4d9bda-f6f9-4e7a-9381-bee4b074b56d,f8033107f8f5a529cf3a231adabb79a3004968ad4453015cbf39635bd66e5427
CHIP-0007,zarifa-the-righteous,Meet Zarifa; a proper baddie for Christ.,,False,367,420,Female,hair: pink; eyes: blue; teeth: none; clothing: v-neck original kente; accessories: none;  expression: none; strength: none; weakness: none,c6955d16-c343-46bc-9bed-c069ea8cc65a,ab94783a65d44731514b48b396d12654187e6819552c7fbdc475a1cdfcb98e2c
CHIP-0007,modinat-the-troublesome,Modinat; The queen of gbas gbos.,,False,368,420,Female,hair: long maroon hair; eye: none; teeth: vampire teeth; clothing: right one-shoulder wax print; accessories: brown glasses; expression: none; strength: none; weakness: none,49eb44e8-1117-463b-b7b3-1bcea4258362,3c14c2eb18ebf9ee3ad9cd0a09d91a0d4a6474ee95224f9186282e91a5a28c0e
